{
  "schemaVersion": "1.2.0",
  "catalogVersion": "fixture-1",
  "denizens": [
    {
      "id": "1",
      "name": "Fixture Denizen",
      "suit": "arcane",
      "restrictions": null,
      "powers": [
        {
          "id": "denizen.fixture-denizen",
          "persistent": false,
          "rulesText": "ACTION: Perform the fixture action."
        }
      ]
    }
  ],
  "relics": [
    {
      "id": "R01",
      "name": "Fixture Relic",
      "role": "ordinary",
      "value": 42,
      "defense": 2,
      "powers": [
        {
          "id": "relic.fixture-relic",
          "persistent": false,
          "rulesText": "Use the fixture relic."
        }
      ]
    }
  ],
  "edifices": [
    {
      "id": "E01",
      "suit": "discord",
      "restrictions": null,
      "intact": {
        "name": "Fixture Edifice",
        "powers": [
          {
            "id": "edifice.e01.intact",
            "persistent": false,
            "rulesText": "The intact fixture rule."
          }
        ]
      },
      "ruined": {
        "name": "Ruined Fixture",
        "powers": [
          {
            "id": "edifice.e01.ruined",
            "persistent": false,
            "rulesText": "The ruined fixture rule."
          }
        ]
      }
    }
  ],
  "legacies": [
    {
      "id": "L01",
      "name": "Fixture Legacy",
      "powers": [
        {
          "id": "legacy.fixture-legacy",
          "persistent": false,
          "rulesText": "The fixture legacy rule."
        }
      ]
    }
  ],
  "sites": [
    {
      "id": "site:fixture-site",
      "name": "Fixture Site",
      "defense": 2,
      "capacity": 2,
      "relicSlots": 1,
      "recoverDifficulty": 1,
      "startingResources": {
        "favor": 1,
        "secrets": 2
      },
      "forgeRequirements": null,
      "handlers": [
        "site.fixture-site.coast"
      ]
    }
  ]
}
